<?xml version="1.0" encoding="UTF-8"?>
<quickvo xmlns="http://www.sagframe.com/schema/quickvo"
	xmlns:xsi="http://www.w3.org/2001/XMLSchema-instance"
	xsi:schemaLocation="http://www.sagframe.com/schema/quickvo http://www.sagframe.com/schema/sqltoy/quickvo.xsd">
	<property file="../../src/main/resources/application.properties" />
	<property name="project.version" value="1.0.0" />
	<property name="project.name" value="sqltoy-showcase" />
	<property name="project.package" value="com.sagframe.sqltoy" />
	<property name="include.schema" value="false" />
	<!-- set method 是否支持返回对象自身(默认是true),即: public VO  setName(String name){this.name=name;return this;} -->
	<property name="field.support.linked.set" value="true" />
	<!-- oracle支持schema,mysql\DB2:catalog -->
	<datasource name="sqltoy" url="${jdbc.connection.url}"
		driver="${jdbc.connection.driver_class}" catalog="${jdbc.connection.catalog}"
		username="${jdbc.connection.username}"	password="${jdbc.connection.password}" />
	<tasks dist="../../src/main/java" encoding="UTF-8">
		<!-- 4.0.6之后增加datasource属性适应多数据库配置,swagger-model:对象是否支持swagger注解 -->
		<task active="true" author="zhongxuchen" include="^SQLTOY_\w+" datasource="sqltoy" swagger-model="false">
			<vo package="${project.package}.showcase.vo" substr="Sqltoy" name="#{subName}VO" />
		</task>
	</tasks>
	<!-- 主键策略配置:
	    identity类型的会自动产生主键策略，其他场景sqltoy根据主键类型和长度自动分配相应的策略方式. 
		strategy分:sequence\assign\generator 三种策略：
			sequence 需要指定数据库对应的sequence名称。
			assign   为手工赋值，
			generator为指定具体产生策略,目前分:default:22位长度的主键\nanotime:26位纳秒形式\snowflake雪花算法\uuid\redis
    -->
	<primary-key>
		<table name="SQLTOY_\w+|SYS_\w+" strategy="generator" generator="default" />
		<table name="SQLTOY_BIGINT_TABLE" strategy="generator" generator="snowflake"/>
		<!--<table name="xxxTABLE" strategy="sequence" sequence="SEQ_XXXX"/> -->
		<!--<table name="sys_staff_info" strategy="generator" generator="snowflake"/> -->
		<!--<table name="sys_staff_info" strategy="generator" generator="redis"/>  -->
	</primary-key>

	<!-- 基于redis产生有规则的业务主键 -->
	<business-primary-key>
		<!-- 1位购销标志_2位设备分类代码_6位日期_3位流水 (如果当天超过3位会自动扩展到4位) -->
		<!-- 业务主键可以充当实际的主键，如果字段是主键会覆盖原来的主键策略 -->
		<!-- 包含的三个宏:
		      @substr(${field},startIndex,length) 
		      @case(value,case1,value1,case2,value2,other)  
		      @df(yyMMdd) 日期格式化,如果不需要加入日期可以用@df('') 
		-->
		<table name="SQLTOY_DEVICE_ORDER_INFO" column="ORDER_ID" generator="redis"
			signature="${psType}@case(${deviceType},PC,PC,NET,NT,OFFICE,OF,SOFTWARE,SF,OT)@day(yyMMdd)"
			related-columns="psType,deviceType" length="12" />
	</business-primary-key>
	
	<!-- 主子表的级联关系 update-cascade:delete 表示对存量数据进行删除操作,也可以写成:ENABLED=0(sql片段,置状态为无效) -->
	<cascade>
		<table name="SQLTOY_DICT_DETAIL" update-cascade="delete" load="STATUS=1" />
	</cascade>

	<!-- 数据类型对应关系，native-types表示特定数据库返回的字段类型; jdbc-type：表示对应jdbc标准的类型(见:java.sql.Types), 
		主要用于vo @Column注解中，设置其类型,方便操作数据库插入或修改时设置类型;java-type:表示对应java对象的属性类型 -->
	<type-mapping>
		<!-- 保留1个范例,一般无需配置 -->
		<sql-type native-types="NUMBER,DECIMAL,NUMERIC"	precision="1..8" scale="0" jdbc-type="INTEGER" java-type="Integer" />
		<!-- 增加雪花算法的演示 -->
		<sql-type native-types="BIGINT"	jdbc-type="BIGINT" java-type="java.math.BigInteger" />
	</type-mapping>
</quickvo>